id,bid,user_id,用户昵称,微博正文,头条文章url,发布位置,艾特用户,话题,转发数,评论数,点赞数,发布时间,发布工具,微博图片url,微博视频url,retweet_id,ip,user_authentication
5149183581359367,PkDum5HDh,2419250181,kiki鲁鲁,O网页链接哪吒2魔童闹海变脸挂件钥匙扣挂饰电影同款变脸表礼品卡通可爱饰长按复制此消息，打开抖音，查看商品,,,,,0,0,0,2025-03-28 14:48,iPhone 13,,,,浙江,普通用户
5149183561696089,PkDuk77eh,7627851579,是张公子啊啊啊,,,,,,0,0,0,2025-03-28 14:48,Xiaomi 14,,,,安徽,普通用户
5149183427217611,PkDu6uhD5,5074743747,九江修水发布,哪吒喊你来森林防火了！森林防火，人人有责！#森林防火##哪吒#L九江修水发布的微博视频,,,,"森林防火,哪吒",0,1,0,2025-03-28 14:47,微博视频号,,"http://f.video.weibocdn.com/o0/X5F0riBslx08n1MKuSek01041200py4J0E010.mp4?label=mp4_720p&template=720x1280.24.0&ori=0&ps=1BVp4ysnknHVZu&Expires=1743254856&ssig=aaLoBmtsO4&KID=unistore,video",,,蓝V
5149183414370709,PkDu5il1j,5663438464,Lii深深,上午春游带孩子们健步走七公里累的最后孩子直喊“刘老师您怎么掉队啦！”下午又精神抖擞地和鲁老师来二刷哪吒了果然工作是工作生活是生活,,,,,0,0,2,2025-03-28 14:47,iPhone客户端,https://wx2.sinaimg.cn/large/006bhd3Gly1hzwol3aypsj32c0340npd.jpg,,,北京,普通用户
5149183267050468,PkDtQtA9e,7242937088,夜栖云屿涧,3.28专栏·小诺,,,,,0,0,0,2025-03-28 14:47,张凌赫一诺所愿皆成真,https://wx3.sinaimg.cn/large/007UaCNWly1hzwon4tf2uj30u01uotkt.jpg,,,北京,红V
5149183090622467,PkDtz2BVN,6098618030,yongdundun,朵姐们好有💰，在哪发的财能带带我吗,,,,,0,0,2,2025-03-28 14:46,iPhone 15,,,,吉林,黄V
5149183003592380,PkDtqf4xC,7764754352,臣不得不脱,#地笼##藕饼#藕饼开窍就很适合，隔着门缝，通过观摩昊天和龙爹两个人厮混，来学习初次x知识。于是敖丙父王被天帝按在床上欺负，小敖丙就被哪吒按在墙角欺负。后来哪吒每回来东海找敖丙便一口一个:“小银龙，小银龙。”敖丙一见他就脸颊发红，要拿龙尾打他，然后两个人闹来闹去，又偷偷摸摸不知道躲哪里去玩了。敖光以为哪吒色盲，敖丙再怎么说也应该是条小蓝龙阿。结果等敖光后知后觉反应过来，哪吒分明是在学天帝喊——小淫龙……龙王意识到自己的乖乖儿子，可能已经神不知鬼不觉被魔丸这个混小子给透了，敖光便有一种眼前发黑，助纣为虐的无力荒唐感。,,,,"地笼,藕饼",2,17,439,2025-03-28 14:45,追妻火葬场Android,https://wx4.sinaimg.cn/large/008tu7jqgy1hzwokm4k4oj308c08ct8q.jpg,,,湖北,普通用户
5149182793878993,PkDt5gh6p,3312512023,itsRen,当呼麦遇上《哪吒2》，北疆文化叩响世界之门-草原云　　　　　　　　　　　　　　　　　　　　　　　　　　　　　　...@QQ浏览器O网页链接,,,QQ浏览器,,0,0,0,2025-03-28 14:45,Redmi Note 14 Pro+,https://wx3.sinaimg.cn/large/c570ec17ly1hzwol5nbq1j208c08cdg5.jpg,,,内蒙古,普通用户
5149182729914395,PkDsYFBbB,2656260151,本世纪最萌豆丁狐,某公园哪吒雕塑因被嘲丑现在工作人员准备重新处理,,,,,0,6,44,2025-03-28 14:44,iPhone 16 Pro Max,"https://wx4.sinaimg.cn/large/9e535037gy1hzwojqm89rj210o12dqgj.jpg,https://wx1.sinaimg.cn/large/9e535037gy1hzwojopx95j210o1ncnfq.jpg,https://wx3.sinaimg.cn/large/9e535037gy1hzwojrpugmj210o0nvalb.jpg",,,浙江,金V
5149168529309707,PkD64D3Sz,7383648432,丁香鱼不吃香菜,燃罪真的太好看了张云龙你暂时不用唱“我用情付诸流水爱比不爱可悲”了你的旭来了,,,,,0,0,0,2025-03-28 13:48,Redmi Note 12 Turbo,,,,安徽,普通用户
5149168356296824,PkD5Nqq5G,7509797300,高能量甜豆妹,三月末vs三月初（一个月的时间带给我什么）,,,,,0,3,0,2025-03-28 13:47,iPhone客户端,"https://wx3.sinaimg.cn/large/008celkUly1hzwmls5px2j31sc2c8kjl.jpg,https://wx3.sinaimg.cn/large/008celkUly1hzwmvbr9y5j31sa29kb29.jpg",,,山东,普通用户
5149168159954013,PkD5tFLuB,1564834725,平原公子赵胜,有人问，什么时候国漫能够超过日漫？最近刚好看了一部小众国漫，叫做《枕刀歌》，不算出名。这是迄今看到最精彩的武侠风动漫，打斗设计几乎是国漫天花板，拳拳到肉、刀刀见血，干净利落，又不乏想象力，关键是那股“中国”味儿，是其他作品里很难见到的，甚至让我有一种错觉，这部动漫，可以给如今所有的武侠影视剧做“动作指导”。片头曲和片尾曲也写得好，“无风无雪一杯酒，无波无浪客舟中，故人一去山水阔，澄江万里接天地……”那种苍凉孤独的感觉就出来了。更喜欢的是那种朴实、甚至有点粗糙的二维画风，每一帧截图，都像是早些年看武侠小说、传奇故事中的插图，建议在电视机上看，视觉效果非常出色。日本的热血漫画也有精彩的战斗，但设计上就是没有这种感觉。很多人都说，为什么今天武侠小说、武打影视不火了，其实不是他们不火，而是武侠题材本身太窄，如果不能融进家国天下、社会众生的思考，那就走不远，如今的作者不行，不能与时俱进，如今的演员也不行，连个基本动作都做不好……演不出武德充沛的味儿。所以，反而是动漫，可以淋漓尽致地表达传统武术、格斗的独特美感。这部作品不是没有缺点的，建议大家从第二部开始看，再反过去看第一部，因为第二部的故事更流畅、人物更丰满，而第一部类似于古龙小说风格，全篇谜语人……实际上讲的道理很好，“你要报仇，但天下人的仇谁来报”？第二部也不完美，把明末士大夫、阉党、军阀之间的斗争脸谱化了，塑造的是作者想象中的英雄……不过没关系，故事流畅就行。这部作品优秀的是，它并没有纯粹的正派和反派，每个人的行事都有他的立场和动机，甚至可以把每一个反派、配角、小人物拎出来做传。这就在画风之上，增加了思想深度。说实话，我并不认为日本那些动漫，能在境界上比它更高明……大部分不过是些庸俗的血统论超级英雄叙事加上色情擦边而已。比如《枕刀歌》、比如《雾山五行》，这种质量已经相当高了，只不过限于目前互联网的圈层化、信息茧房问题，难以为大众所知而已，实际上它们的粉丝是非常多的，离破圈，只缺一次大电影的发行和营销而已。如今国漫其实已经在井喷状态了，说几说几部更火的《凡人修仙传》、《永生》、《遮天》，追番的人天天刷梗，二创段子到处飞，甚至就连《一世之尊》都动漫化了，如今圈子里最饱受好评的，是《牧神记》，大场面大制作……中国的神话、仙侠、武侠以及网络文学是一个取之不尽，用之不竭的宝库，动漫制造业落后了差不多十年，当人力物力开始投入后，结果可想而知。漫画是人画的，剧本是人写的，动画是人制作的，最后拼的就是脑力和生产力，哪有什么神秘不可触碰的东西。2025年了，为什么还抱着那些“日本动漫不可超越”的思想钢印不放？全日本所有的动漫电影绑在一起，打得过《哪吒2》吗？#国漫##枕刀歌##哪吒2全球动画第1#,,,,"国漫,枕刀歌,哪吒2全球动画第1",133,141,777,2025-03-28 13:46,HUAWEI Mate 60 Pro+,"https://wx3.sinaimg.cn/large/5d457ba5gy1hzwmuxrn68j20yw0hidxg.jpg,https://wx2.sinaimg.cn/large/5d457ba5gy1hzwmuyomtkj20yo0j24mg.jpg,https://wx2.sinaimg.cn/large/5d457ba5gy1hzwmv01vp8j20xc0iye4g.jpg,https://wx1.sinaimg.cn/large/5d457ba5gy1hzwmv0z7jbj20ys0kmavi.jpg,https://wx1.sinaimg.cn/large/5d457ba5gy1hzwmv21m9bj20xw0i6tzr.jpg,https://wx2.sinaimg.cn/large/5d457ba5gy1hzwmv2wupij223k0z0wsi.jpg,https://wx2.sinaimg.cn/large/5d457ba5gy1hzwmv3pkpaj223k0z0152.jpg,https://wx2.sinaimg.cn/large/5d457ba5gy1hzwmv48gsij223k0z0k31.jpg,https://wx4.sinaimg.cn/large/5d457ba5gy1hzwmv5cv44j223k0z04e4.jpg",,,江苏,金V
5149168093368274,PkD5ne8f0,2649602633,VERA_yyyyyj,告诉银临，这个月我在妖扬这儿不回去了,,,,,0,2,2,2025-03-28 13:46,iPhone客户端,https://wx4.sinaimg.cn/large/9dedba49gy1hzwmw9c634j23b04eox6p.jpg,,,湖南,普通用户
5149167945255617,PkD58m3e1,1626695251,喜欢三观端正的人,《黑神话：哪吒》5分钟实机演示#哔哩哔哩动画#O《黑神话：哪吒》5分钟实机演示,,,,哔哩哔哩动画,0,0,1,2025-03-28 13:46,哔哩哔哩,https://wx1.sinaimg.cn/large/60f56653ly8hzwmvs30bij21hc0u00wr.jpg,,,浙江,普通用户
5149167904098114,PkD54hc6C,3451485754,腼腆小美拿捏小帅,陈塘关第一幼儿园开放日小饼不会比心也不太会看镜头#电影哪吒之魔童闹海﻿#,,,,电影哪吒之魔童闹海﻿,0,1,29,2025-03-28 13:45,哪吒之魔童闹海超话,https://wx2.sinaimg.cn/large/cdb97e3aly1hzwmvll8p9j20u00xidjq.jpg,,,山东,金V
5149167894922050,PkD53kErU,7817473574,梅之川,任嘉伦超话#任嘉伦无忧渡##任嘉伦宣夜##任嘉伦#冷静下来，不要抱怨这个世界的不公平，因为这个世界本来就是这样好无聊啊@任嘉伦Allen,,,任嘉伦Allen,"任嘉伦无忧渡,任嘉伦宣夜,任嘉伦",1,8,7,2025-03-28 13:45,任嘉伦超话,https://wx2.sinaimg.cn/large/008x3jZsgy1hzwmvk9swlj30qo1beahx.jpg,,,四川,普通用户
5149167875000109,PkD51kYKV,2106145907,奶牛灬我是豆奶粉,#库迪哪吒联名#看完隔壁的偷跑坐等库迪第二弹,,,,库迪哪吒联名,0,1,0,2025-03-28 13:45,iPhone客户端,https://wx4.sinaimg.cn/large/7d893c73gy1hzwmv7wtz5j22c0340e83.jpg,,,上海,普通用户
5149167869755468,PkD50EVQg,7599280163,鱼丸粗面ni必中签,哈哈哈我的这个头像嘛…看着就很好吃捏,,,,,0,2,2,2025-03-28 13:45,于文文超话,https://wx4.sinaimg.cn/large/008ihNUTgy1hzwmvg2pgvj32c0340b2b.jpg,,,四川,普通用户
5149167815229842,PkD4VlWwi,2784267757,Try热巴是我老婆ToLover,哪吒大战石矶娘娘#生活手记#LTry热巴是我老婆ToLover的微博视频,,,,生活手记,0,0,0,2025-03-28 13:45,iPhone客户端,,"http://f.video.weibocdn.com/o0/cphdq29dlx08n1Iunle0010412004Qov0E010.mp4?label=mp4_720p&template=1280x720.25.0&ori=0&ps=1BVp4ysnknHVZu&Expires=1743254871&ssig=b6uoUQE6ER&KID=unistore,video",,上海,普通用户
5149153709785238,PkCIaF3Aq,2994692531,平常心_tt,挣扎。。。。。哪吒超话#高光时刻#敖光超话,,,,高光时刻,0,0,0,2025-03-28 12:49,敖光超话,,,,北京,普通用户
5149153529692459,PkCHSEFrZ,3169161174,脑子油饼去治,这个ses发🎺就算了怎么数据还第一名哦,,,,,0,33,71,2025-03-28 12:48,丨iPhone客户端,https://wx3.sinaimg.cn/large/bce58fd6gy1hzwl7shqyzj20zu1b4qfg.jpg,,,江苏,金V
5149153526809902,PkCHSszz8,7869679098,草莓啵啵奶汁,光线哪吒的钱全花姐弟俩身上了,,,,,0,0,0,2025-03-28 12:48,iPhone 15 Pro,,,,浙江,黄V
5149153472284183,PkCHN9AdF,7493180869,柠檬酸了椰ovo,#赵露思生病前认为拐杖只是装饰#的相关内容，来智搜看看。回家吧孩子，父母会守护你的天真无邪赵露思生病前认为拐杖只是装饰,,,,赵露思生病前认为拐杖只是装饰,0,10,11,2025-03-28 12:48,所愿皆成真,,,,广东,红V
5149153471760505,PkCHN7nZf,6542777061,Y-xxxxxxxxx,老干妈不知道是我浩问题还是什么上次那个轮博可能会轮的特别慢,,,,,0,7,5,2025-03-28 12:48,微博网页版,,,,浙江,红V
5149153454197041,PkCHLhBQd,3273677645,阿兹卡班在逃劳德,众神之神超话B站有科普博主，造谣毗湿奴是哪吒原型的，就是说，科普这碗饭太容易吃了,,,,,0,0,0,2025-03-28 12:48,众神之神超话,,,,山东,普通用户
5149153337545165,PkCHzvEQd,7897922130,Oz小奥,玉结连环寨，哪吒散去全部鬼兵，玄青帐幔成为杨戬和哪吒在战场的温存之地。杨戬抚琴哪吒舞剑，前者垂眸拨弄琴轸，奏至尾音，下巴却突然被冰冷的剑尖抵住，剑锋堪堪刺着喉咙要害。琴声戛然而止，杨戬十指虚按丝弦，只是静静仰头看着对方的居高临下，月轮倾泻霜华，执剑者周身描摹银箔一般的冷光，隐于暗处的面容恍若浸在墨池里的玉珏。“不运玄功护体吗？”哪吒气息平稳如初，仿佛方才的剑舞不过是信手折枝。杨戬望着他眉间沉淀的凛冽，依稀间回想起与哪吒的初次见面，那个健朗明艳的少年如今已被战火淬炼成了执掌杀伐的诛魔元帅。“元帅要赐死，杨某自当引颈。”杨戬尾音浸着慵懒笑意，顺着他的话打趣下去。他将自己的下巴主动搁在剑上，在这柄沾了了无数妖魔血的阴阳剑上如狸奴一般轻轻地厮磨。意料之外的乖顺无疑取悦了久居沙场百无聊赖的元帅。他仍然不够满足，挑起杨戬的下巴让月光充分倾泻在他俊美如玉的面颊上，翻转剑身迫使这张脸随着月影偏转，从含情目到微启唇，将那人的五官凝了个遍。“这般绝色，殒命岂非可惜。”哪吒的语气相当怡悦，双眸浮动一圈鎏金的涟漪。我爱看霸娇。霸：指哪吒,,,,,4,23,50,2025-03-28 12:48,元戎府Android,,,,四川,黄V
5149153279347184,PkCHtDdD2,6256783108,旺儿的时尚与读书笔记,喜欢的歌循环着，开始一个下午的劳动分享单曲K游山恋(梦幻西游五庄观门派曲;《梦幻西游》电脑版五庄观门派曲)(@网易云音乐),,,网易云音乐,,0,0,0,2025-03-28 12:47,网易云音乐,,,,辽宁,普通用户
5149153123632655,PkCHeff1d,5836117692,明月映苍山,小时候就是因为玩这个游戏以为哪吒是个女孩子,,,,,0,1,0,2025-03-28 12:47,Redmi K60,https://wx3.sinaimg.cn/large/006mXKOwly1hzwl5oza9nj313y0u0jzv.jpg,,,北京,普通用户
5149153114195002,PkCHdhBjk,7381343447,Thestar丨熊猫滑滑板,可帮闷星代买古茗周边我已经有四五套了吼吼吼！！小城市的唯一好处咯就是么得方巾,,,,,0,9,2,2025-03-28 12:47,小米10 至尊纪念版,https://wx3.sinaimg.cn/large/0083xmCzgy1hzwl63eid0j30u01qj0zo.jpg,,,贵州,黄V
5149138569137408,PkCjKCl3y,7427439140,鄄城县融媒体中心,【#哪吒2激发老外对中国的好奇心#】#哪吒2比利时首映一票难求#当地时间26日，中国动画电影《哪吒之魔童闹海》（即《哪吒2》）比利时首映活动在布鲁塞尔举办。当天，布鲁塞尔影院厅座无虚席，一票难求。观众们纷纷表示，虽然早就听说《哪吒2》非常好看，但看了之后依然十分惊喜，这部电影从制作到内容，精彩程度超乎想象。还有的观众表示，《哪吒2》还激发了他们对中国的好奇心，希望有机会能亲自到中国来。L央视网的微博视频,,,,"哪吒2激发老外对中国的好奇心,哪吒2比利时首映一票难求",5,8,8,2025-03-28 11:49,iPhone客户端,,"http://locallimit.us.sinaimg.cn/o0/48hdHvyllx08n0mmBBBS01041200wm2s0E010.mp4?label=mp4_720p&template=1280x720.25.0&ori=0&ps=1BVp4ysnknHVZu&Expires=1743254898&ssig=RLbGMS2F3%2B&KID=unistore,video",,山东,蓝V
5149138426267468,PkCjwqisc,3807184648,爱吃麻辣香锅的花西兰,造吃造吃,,,,,0,0,1,2025-03-28 11:48,iPhone客户端,"https://wx2.sinaimg.cn/large/e2ed0708ly1hzwjgudtuxj23b04eox6r.jpg,https://wx3.sinaimg.cn/large/e2ed0708ly1hzwjgwtbagj24eo3b0kjn.jpg",,,陕西,普通用户
5149138422074673,PkCjw8HIt,7137901523,浪漫一生_34,真是越老越帅的典范！其他明星都需要节食抗老医美才能维持年轻态和气质剑心雕龙_的视频O一个男人50岁后能帅到什么程度，苗侨伟2007-2022年角色大汇集,,,,,0,0,0,2025-03-28 11:48,HarmonyOS设备,,,,江苏,普通用户
5149138341858452,PkCjo7Nt2,6017919835,Nussknacker_0,北京的花花也开啦,,,,,0,0,3,2025-03-28 11:48,Redmi K60,https://wx3.sinaimg.cn/large/006zgzR9ly1hzwjh6ovtbj313y0u0gxp.jpg,,,北京,普通用户
5149138308828111,PkCjkB2AT,6254186744,坠入我心底的星辰,刚刚在线了，有大事发生吗,,,,,0,0,1,2025-03-28 11:48,杰的星Android,https://wx4.sinaimg.cn/large/006PfVFKly1hzwjh8sb19j30qo0ad74r.jpg,,,河北,黄V
5149138263215658,PkCjgduxs,7576256505,荥阳市融媒体中心,分享视频L荥阳市融媒体中心的微博视频,,,,,0,0,0,2025-03-28 11:48,微博视频号,,"http://f.video.weibocdn.com/o0/tIPSfUhQlx08n1Aqny6s01041200rGG70E010.mp4?label=mp4_720p&template=720x1280.24.0&ori=0&ps=1BVp4ysnknHVZu&Expires=1743254898&ssig=yzBTkDOxFr&KID=unistore,video",,,蓝V
5149138263212343,PkCjgdtFZ,7347561936,用户7347561936,我正在听肖雨蒙的歌曲《我不是哪吒也不是魔丸》（来自@酷狗音乐），你也来听听吧！O网页链接,,,酷狗音乐,,0,0,0,2025-03-28 11:48,手机酷狗安卓版,https://wx4.sinaimg.cn/large/0081fCvuly1hzwjh13mzrj30k00k0goe.jpg,,,河北,普通用户
5149138245649956,PkCjenHOk,7379828782,又在潮湿的下雨天幻想被爱,氪都氪了想把幕间也拿下了,,,,,0,1,0,2025-03-28 11:48,Android,https://wx3.sinaimg.cn/large/0083r0Augy1hzwjgz9b5oj30xr0qqk6x.jpg,,,广东,普通用户
5149138221795608,PkCjc7x7q,1767902814,巧工记,#宋雨琦在地上躺了四分钟#这工作真是太辛苦了。让我替她受这个苦吧。《《哪吒2》99%的票房都来自中国被诟病，有没有一种让绝大多数人都难以抗拒的中国文化输出方式呢？》O《哪吒2》99%的票房都来自中国被诟病，有没有一种让绝大多数人都……O网页链接《3A游戏《黑神话悟空》和3E游戏《如意兽》的对比分析，实体作品《如意兽》的竞争力展望》O3A游戏《黑神话悟空》和3E游戏《如意兽》的对比分析O网页链接,,,,宋雨琦在地上躺了四分钟,0,0,0,2025-03-28 11:48,微博搜索,,,,广东,普通用户
5149138121133897,PkCj24KYF,2881030352,双流应急,【沙画哪吒讲防火】山河无恙岁月柔，守护青山人人担！#森林草原防火季#@龙岩森林消防支队L应急管理部的微博视频,,,龙岩森林消防支队,森林草原防火季,0,0,0,2025-03-28 11:47,微博视频号,,"http://f.video.weibocdn.com/o0/3vK3yADXlx08n0rlkEYo01041200y5Ty0E010.mp4?label=mp4_720p&template=1280x720.25.0&ori=0&ps=1BVp4ysnknHVZu&Expires=1743254898&ssig=MG6iuQrfot&KID=unistore,video",,,蓝V
5149124085154661,PkBWolCXH,3830204352,四川大学华西厦门医院,#哪吒的牙为何参差不齐？华西厦门医院口腔医学中心正畸科王鹏飞医生给你解答！#口腔健康#L四川大学华西厦门医院的微博视频,,,,哪吒 的牙为何参差不齐？华西厦门医院口腔医学中心正畸科王鹏飞医生给你解答！,0,0,0,2025-03-28 10:51,微博视频号,,"http://f.video.weibocdn.com/u0/xOx15raggx08n1wyIcVy01041200rU0O0E010.mp4?label=mp4_720p&template=720x1280.24.0&ori=0&ps=1BVp4ysnknHVZu&Expires=1743254906&ssig=gfnkoDgNG5&KID=unistore,video",,,蓝V
5149123976102559,PkBWdpByn,2497667972,打哈欠就该睡了_,用相柳戒断唐奇后劲太大不如看看小元莫吧,,,,,4,25,52,2025-03-28 10:51,檀健次超话,,,,广西,金V
5149123972171669,PkBWd96WV,7974027499,非遗风火轮,#哪吒2电影的全球火爆为中国非遗走向世界提供了一个非遗传承发展跨界融合的路径，梳理哪吒跨界非遗的内容形式，总结非遗跨界的多元化融合路径和未来发展方向#的相关内容，来智搜看看。《哪吒2》的成功证明，非遗的活态传承需打破“博物馆式”保护思维，通过跨界创新激活传统基因。未来中国文化的全球传播，或将依托“技术硬实力+叙事软实力”的双轮驱动，构建更具弹性的文化输出生态。#非遗在身边#,,,,"哪吒2电影的全球火爆为中国非遗走向世界提供了一个非遗传承发展跨界融合的路径，梳理哪吒跨界非遗的内容形式，总结非遗跨界的多元化融合路径和未来发展方向,非遗在身边",0,3,0,2025-03-28 10:51,,https://wx3.sinaimg.cn/large/008HEcOLly1hzwhuqrpubj30v98bxe83.jpg,,,北京,红V
5149123931014276,PkBW94fRi,1822433171,SugiBaby,哪吒之魔童闹海超话泡泡玛特哪吒之魔童闹海盒机转赠～～战斗吒战斗丙捣蛋吒乖巧丙藕粉吒藕粉丙～～如图原价转～～画重点～～原价～～～可单出可对出可allin可小刀～,,,,,0,4,0,2025-03-28 10:51,哪吒之魔童闹海超话,"https://wx1.sinaimg.cn/large/6ca01f93gy1hzwhsz5nvuj20u0180gsu.jpg,https://wx4.sinaimg.cn/large/6ca01f93gy1hzwhszgn6tj20z00nwjwc.jpg",,,广东,普通用户
5149123814098253,PkBVXhc8R,3495617837,爽爽贵阳·文昌云岩,遇到铁子！广西老表极速往返看哪吒“五刷！专门为了这块屏幕来”“两点到贵阳直奔影院，晚八点半返回桂林”（采访：田野；摄制：赵万江；编审：张玥）#云岩区##文昌云岩##贵阳越界影城##真诚是贵州文旅出圈的必杀技#L爽爽贵阳·文昌云岩的微博视频,,,,"云岩区,文昌云岩,贵阳越界影城,真诚是贵州文旅出圈的必杀技",0,0,1,2025-03-28 10:50,微博视频号,,"http://f.video.weibocdn.com/u0/7EuCtqJWgx08n1wtS1Es01041200rmgX0E010.mp4?label=mp4_720p&template=720x1280.24.0&ori=0&ps=1BVp4ysnknHVZu&Expires=1743254906&ssig=PmAnfcZ8Fo&KID=unistore,video",,,蓝V
5149123809640718,PkBVWErZs,7823736373,锦时少光,今天是个好日子~快乐如此简单,,,,,0,3,0,2025-03-28 10:50,微博轻享版,,,,河北,普通用户
5149123767435959,PkBVSvcqP,6979771344,凯始begin咻k,买星巴克总会不自觉地套上其他品牌的杯套，因为害怕我的购买频率让身边的人自卑进而产生距离感。低调一直是我们家的家训，我也十分讨厌让别人产生不适的情绪，所以一直用蜜雪冰城和瑞幸示人。直到有一天同学请大家喝星巴克，其他人都支支吾吾半天不知道该点什么，等到了我，我直接流利地说了一句“grande的枫叶拿铁标准冰谢谢”，在场的同学直接呆住了。我这才意识到一直以来的伪装都功亏一篑，不过还好同学们也没有因此疏远我谢娜不知道在忙些什么谢娜你好星期六惩罚舞蹈曝王大陆涉嫌逃兵役被捕难哄王鹤棣代露娃咸鱼飞升陈晓陈妍希离婚石矶娘娘配音演员照片宛如石矶本矶黄渤说姜子牙会钓鱼也会摸鱼苗苗生育状况写多子女六姊妹的瓜吃完一个还一个哪吒里有藕霸唐探里有欧巴台媒称看李现的剧想去云南定居难哄开播才明白刘诗诗新剧英文名含义吴倩六姊妹演技看唐探1900从呲个大牙到拉个大脸颖儿新剧裸婚被赶出家全球票房榜卖伞人家却给不了孩子遮风避雨的家春晚机器人要小心向佐了吒儿感谢成龙叔叔的鼓励饺子票房成绩超过陈凯歌51岁何炅的八块腹肌外国观众看完哪吒是懂内涵的仙台有树前8集演了别人一部剧哪吒2已成美社交媒体网友讨论新话题金秀贤抽烟路透哪吒2在美一票难求纽约华人发声张云雷称在家24小时被私生饭监控哪吒2票房超76亿掌心咬戏比吻戏还带感哪吒2这个画面一帧渲染了1.5小时麻六记直播遭恶意下单#生活手记#王嘉尔宣布回归袁咏仪张智霖结婚24周年于正新签两个短剧演员,,,,生活手记,0,0,0,2025-03-28 10:50,xpx的phoneAndroid,,,,青海,红V
5149123762980590,PkBVScvo2,1774215272,武汉广播电视台,【#62岁奶奶进修社区大学成功爆改#】近日，青岛城阳区凤凰山社区，62岁奶奶进入社区大学学习后，从脾气暴躁的“喷火龙”奶奶成功爆改暖心友善的社区热心奶奶。自2024年6月，凤凰山社区以文化“两创”破局，开设社区大学，居民从“服务对象”转变为“治理主力”，成为基层治理的“青岛样本”。而这样的故事，正在更多社区陆续上演.....网友：#60来岁正是上学的年纪#～#哪吒2比利时首映一票难求#L青岛新闻网的微博视频,,,,"62岁奶奶进修社区大学成功爆改,60来岁正是上学的年纪,哪吒2比利时首映一票难求",0,0,3,2025-03-28 10:50,微博视频号,,"http://f.video.weibocdn.com/o0/c8rdXalNlx08n1t3h71S01041203tY5s0E020.mp4?label=mp4_720p&template=1280x720.25.0&ori=0&ps=1BVp4ysnknHVZu&Expires=1743254906&ssig=AdQs1%2B0l7B&KID=unistore,video",,,普通用户
5149123737031346,PkBVPtvaO,3123721630,长沙消防,【哪吒票房“狂飙”消防安全紧追】#哪吒2比利时首映一票难求#，观影时可别忘了消防安全，遵守影院相关消防安全规定，让安全常伴，快乐加倍！L湖南消防的微博视频,,,,哪吒2比利时首映一票难求,0,0,0,2025-03-28 10:50,微博视频号,,"http://f.video.weibocdn.com/o0/FQSDeTSzlx08m6yONapy01041200g9tW0E010.mp4?label=mp4_720p&template=720x1280.24.0&ori=0&ps=1BVp4ysnknHVZu&Expires=1743254906&ssig=K8NHDY7W0E&KID=unistore,video",,,蓝V
5149123733880971,PkBVPghCj,6979771344,凯始begin咻k,本人急用钱，转让雪碧一瓶。上个月1号买的，才喝了一小口，里面还有很多气，平时一直放在冰箱里面，没舍得喝。九成新，假一赔十，真心好喝，价格私聊。买不起的帮我宣传可以，但别捣乱。另外，谁还没有急用钱的时候，谁也别笑话谁。汪小菲现任妻子mandy发声台媒证实大S最终死因是败血症mandy说能做的是照顾好两个小孩小S返台时间不对外公开败血症张颖颖说汪小菲在立深情人设汪小菲评论大S老婆我好想你汪小菲说死的人应该是我经纪人辟谣周渝民发20条悼念大Smandy称汪小菲现在状况不好舌尖4西湖醋鱼让司机师傅沉默了小S取消节目录制具俊晔将手抱骨灰带大S回台湾满江红祝贺哪吒敖光daddy哪吒2哪吒1贴贴哪吒2。沈腾林允#生活手记#,,,,生活手记,0,0,0,2025-03-28 10:50,xpx的phoneAndroid,,,,青海,红V
